user_id,tweet_id,tweet_text,class,tweet_text_clean
user1087,5c2f01170e98,"""@Thinspomy: Dicen que son muy delgadas
Para mi son perfectas. #thinspo #thinspiration  https://twitter.com/Thinspomy/status/606649026151370752/photo/1pic.twitter.com/xJ8Hi8V4zM """,anorexia,thinspomy decir delgado perfecto
user1088,96df07ef343c,"¡Ven! Te ofrecemos las mejores instalaciones para que practiques #natación como te lo mereces, sin tener de qué preocuparte .
      
.
     
#Swimming  #piscina https://www.instagram.com/p/BvNN9qrnNVB/?utm_source=ig_twitter_share&igshid=1x0g86ktrd1xp …",control,ver ofrecer mejor instalación practiqu merez tener preocuparte
user1089,6ea0ea71ac31,"""#ParaEllas En #PlanetaSports tenemos las camisetas #NewBalance con tecnología de secado rápido que absorbe la humedad del cuerpo.
#Deportes #Running #Training #NB #Venezuela """,control,camiseta tecnología secado rápido absorbe humedad cuerpo
user1090,f0586764d8af,"Croquetas de jamon.
Os las enseñó por dentro. 
#croquetasdejamon #croquetas #caseras #buenas #divinas #ensupuntodesal  #realfooder #somosloquecomemos #ricoysano #noesdieta #hungry #yummy #instadelicious #delicious #foodtruck #instaeat #gourmet #instafood #tasty #foodie",control,croqueta jamon enseñar dentro
user1091,b6b3c980ba70,Quiero mi cuerpo así #inspiración #algundia,anorexia,querer cuerpo así
user1092,e4c78c474e4b,Un día más sin poder caminar o correr y aquí habrá depresión !!!!  #staystrong #govegan #healthylifestyle,control,día poder caminar correr aquí depresión
user1093,e29113b41191,"¿Has encontrado esos lugares de tu interior que luchan por salir y por miedo -al que dirán- los dejas guardados? 
#model #fit  #ballet #ballerina #balletdancer #ballerinaproject_… https://www.instagram.com/p/BvJkoVpB4iX/?utm_source=ig_twitter_share&igshid=uu8fuqv8on8e …",control,encontrado lugar interior luchar salir miedo decir deja guardado
user1094,9af2628a1ac6,"Ya tenéis los regalos de Navidad comprados? Yo no  así que a desayunar bien y a por ello. A ver si me llega la inspiración...
 #desayuno #breakfast  #food #sunday… https://www.instagram.com/zaralogro/p/BrcVkk-HEib/?utm_source=ig_twitter_share&igshid=omx1tzxg5k61 …",control,regalo navidad comprado así desayunar bien él ver si llegar inspiración
user1095,11d4d430f36d,"Gran film...
Ya estoy pensando como evitar el almuerzo de hoy.

#ana #mia  #anorexia #bulimia #depresion #depressed #coldprince #cocaine #dope #drugs #grunge",anorexia,gran film pensar evitar almuerzo hoy
user1096,80fe163aff16,"¿Se puede comer sano sin dejar de salir en #Fallas o fiestas populares? ¡Se puede! Nuestra nutricionista Arancha Navarrete nos da algunos consejos para conseguirlo 

#ConfíaEnSanus",control,poder comer sano dejar salir fiesta popular poder nutricionista arancha navarrete dar consejo conseguir él
user1097,0edbbeab3435,"Cuando Internet nos ayuda a contar historias que ayudan a crear conciencia

http://www.setcabarcelona.com/testimonios-tca-y-como-las-redes-sociales-ayudaron-a-contar-su-historia/ …

#anorexia",control,internet ayudo contar historia ayudar crear conciencia
user1098,8049d153ee22,"Nos dicen cobardes cuando somos lo contrario, para cortarnos, dejar de comer, vomitar prácticamente todo lo que llegues a comer, no es fácil se necesita fuerza de voluntad y determinacion para a ser lo.........

#sueycat
#personshit",anorexia,decir cobard contrario cortarno dejar comer vomitar prácticamente llegu comer fácil necesitar fuerza voluntad determinacion ser
user1099,9c87163b6bb4,"Consejos de nuestra compañera Gemi Osorio, entrenadora personal de O2CW Manuel Becerra, para olvidar la #operaciónbikini que cada año enfrentamos. El truco: 60% alimentación+40% deporte. ¿Te apuntas al método? http://mtr.cool/ofohjpg  #gym  #reto2 #operaciónbikini",control,consejo compañera gemi osorio entrenadoro personal ocw manuel becerra olvidar cada año enfrentar truco alimentación deporte apunta método
user1100,d5f59ba13ddc,Ser delgadas nuestra meta.,anorexia,ser delgado meta
user1101,dfab2a3d0d56,"Quieres algo rico y rendidor? Combina camarones con verduras, Camarones con calabacitas

http://ow.ly/KVcO30nJuLW 

#cocinafacil #comersano #healthyfood #foodporn #food #foodie #foodgasm   #instafood #recetasrapidas #recipe #recipes #recetas #comidamexicana #mexicanfood",control,quier rico rendidor combinar camarón verdura camarón calabacita
user1102,7502f42277c5,"Comí hasta no poder y que es lo seguía ... obvio,vomitar.   

ESA ES LA #UNICA SOLUCIÓN. 

 #thinspiration #thinspo #futuro",anorexia,comí poder seguir obviovomitar solución
user1103,4cc139c25856,"Tocó ser feliz, porque flaca ya no se pudo... 
.
.
.
.
.
#foodismycrush #foodporn #endiciembreladietanoexiste #dietaenenero  #burger #foods #glutenfree #foodstagram #foodblogger… https://www.instagram.com/p/Bq0REdsh2N0/?utm_source=ig_twitter_share&igshid=1e4ea9qe45yhl …",control,tocar ser feliz flaco poder
user1104,f5fa10fbe79d,Me da tanto miedo cuando llega la noche y tengo que encerrarme con todos ellos y saber que nadie mas los puede escuchar solo yo,anorexia,dar miedo llegar noche encerrar yo saber nadie mas poder escuchar solo
user1105,328d17912754,"#FundaciónAPE hace formación, divulgación y concienciación para prevenir los #TCA http://mtr.cool/kacekcs  #bulimia #anorexia #trastornosporatracón #trastornosalimentarios #stopTCA",control,hacer formación divulgación concienciación prevenir
user1106,2e59f480eaba,"#sociedaddemierda  #perfect
Que irónico, la sociedad nos enseña unos cánones de belleza y a la vez nos critican por seguirlos.",anorexia,irónico sociedad enseño canon belleza vez criticar seguirlo
user1107,9198a62eebe3,"Desayuno power para un día largo

Pernil de Cerdo cocido con palta/aguacate, pimientos salteados en aceite de coco y mantequilla.

Obviamente acompaña mayonesa casera hecha con aceite pepita de uva

@MetodoGrez #LowCarbChile #lowcarb #keto #lchf",control,desayuno power día largo pernil cerdo cocido paltaaguacate pimiento salteado aceite coco mantequilla obviamente acompaña mayonesa casera hecho aceite pepitar uva metodogrez
user1108,dd336c4f656b,solo traigo en el estomago dos taquitos de frijol,anorexia,solo traigo estomago dos taquito frijol
user1109,987bce9a4a5d,"A cenar!!!!
Brocoli con huevo y pasas 
 #LoveBrocoli",control,cenar brocoli huevo pasa
user1110,11c7d6956a74,Que perfeccion *-* puedo ser asi??,anorexia,perfeccion poder ser asi
user1111,1261f334ea82,acelerar el metabolismo para adelgazar | Carla Diaz TV https://youtu.be/tnANM6YCKlI  #adelgazar  #remedioscaseros #remediosnaturales #salud #belleza #metabolismo #gym,control,acelerar metabolismo adelgazar car él diaz tv
user1112,8885c1521556,1er día de ayuno #reto15dias #ayuno  #luchandoporserperfecta,anorexia,er día ayuno
user1113,61f20081fefb,"Día terminado, cero calorías ingeridas. Lo mejor que me pasó en el dia #ayuno #fast  #BadDay",anorexia,día terminado cero caloría ingerida mejor pasar dia
user1114,c80d09fb522b,"Muy recomendable el documental por que te enseña la mierda que dan en una cadena de ultraprocesados, pero tambien en comedores de colegios, hospitales, la publicidad... etc. 

Gracias a movimientos como  se está cuajando algo muy bueno, seguiremos en la lucha!!!",control,recomendable documental enseño mierdo dar cadena ultraprocesado tambien comedor colegio hospital publicidad etc gracias movimiento cuajar bueno seguir lucha
user1115,e2d0e93a650e,"Necesito bajar 12 kilos YA.
 #proana #promia #meodio",anorexia,necesitar bajar kilo
user1116,ca02327b6171,"Seguramente estareis pensando: ya está aquí el cansino con su  ¿no?
¿Pues la verdad es que yo solo quiero enseñaros mis  #calcetines de los #Avengers que, por cierto, són súper 
Y las zapatillas? También 
#socks #nuts #zapatillas",control,seguramente estareis pensar aquí cansino pues verdad solo querer enseñaro cierto són súper zapatilla
user1117,11ce972fa21d,"""Es el nuevo gurú de las top models, ¿sabes por qué? Porque si sigues sus pautas conseguirás una silueta esbelta y fuerte en dos semanas"". @cuore recomienda ""El método Sakuma"", de Kenichi Sakuma, el último ""bestseller"" que viene de Japón. 
https://bit.ly/2T8ZNij",control,nuevo gurú top models saber si sigu pauta conseguirá silueta esbelta fuerte dos semana cuore recomendar método sakuma kenichi sakuma último bestseller venir japón
user1118,59284c1aa1e6,la perfeccion si existe,anorexia,perfeccion si existir
user1119,a3cb4f3779d8,"Día uno, no sin ti... O sí pero día uno de cumplir mis metas aún que solo sea esta de ser delgada.  #dejadesergorda #hoyvoyacambiar #valevergalavida",anorexia,día día cumplir meta aún solo ser delgar
user1120,8a08449cf66c,"Al mal tiempo, camarones salteados 

#omega3 #saludable #nutricion   #perdergrasa #perderpeso #comidasana #eatclean #eatingclean #weightlose #paleo #healthy https://www.instagram.com/p/BsI-2iWhYcn/?utm_source=ig_twitter_share&igshid=mh9wmvbkg3iv …",control,mal tiempo camarón salteado
user1121,44e3742fd692,"Yo ayunando y le cocino a mi hijo. Uds. No saben lo difícil que es esto.

Palta/aguacate rellena con atún y mayonesa casera sobre cama de berros y dientes de dragón

@MetodoGrez #LowCarbChile #keto #lchf",control,ayunar cocino hijo uds saber difícil paltaaguacate relleno atún mayonés casera cama berro diente dragón metodogrez
user1122,5fb682c1b8a2,"Verano, la época negra de los TCA por la necesidad de estar perfectas ¿ayuda? http://ow.ly/AYVre  #anorexia #bulimia",anorexia,verano época negro tca necesidad perfecto ayuda
user1123,53c4d59c103f,"Photo: La comida es arte, y el arte se hizo para ver no para comer #HappyMoments  #love http://tmblr.co/Zwetqw1C8NFrK",anorexia,photo comido arte arte hacer ver comer
user1124,5da200b2d52a,"Mí estómago está hinchado de tanto vomitar, me duele la cabeza y la garganta me arde cada vez que trago saliva. Todo por romper una simple regla. #dejardecomer  #vomitar #NoPainNoGain",anorexia,estómago hinchado vomitar doler cabeza garganta arder cada vez trago salivo romper simple regla
user1125,82cf6faf235b,"Según #Internet saltar 2 horas quemas alrededor de 1000 #calorias 
Lo intentare 


 
#tip 
#nomasgorda 
#F #Thinspo",anorexia,según saltar hora quema alrededor intentarar
user1126,f09a7a9529ae,"Tras un día de excesos, toca volver a lo sano. Con cenas como esta, no echo en falta los #cheatmeal 

 Merluza y pescadilla en una cama de calabacín y cebolla con orégano/albahaca, y huevos con pimentón dulce. Hecho todo al horno 

  #stayfit",control,tras día exceso tocar volver sano cena echo faltar merluzo pescadillo cama calabacín cebollo oréganoalbahaca huevo pimentón dulce hecho horno
user1127,9eaa3725ace1,"Me gustaría regresar a las andadas de  pero además de que no tengo la fuerza de voluntad de esa época hay muchas cosas que perdí que me han costado mucho recuperar, entre ellas mi cabello  Se me caía un chingo y ahora ya no regresan mis rizos",anorexia,gustar regresar andado además fuerza voluntad época mucho cosa perdí costado recuperar cabello caer chingo ahora regresar rizo
user1128,cba494b81ec3,Encuentra lo que más te apasiona y sigue adelante #modelling #model #fashion  #photography #modeling #modellife #models #style #follow #fashionmodel #photooftheday  #photographer… https://www.instagram.com/p/BvQCBhShLbo/?utm_source=ig_twitter_share&igshid=havs2y2fpccu …,control,encontrar apasión seguir adelante
user1129,22968d61930a,Según las pruebas médicas peso 72 kilos. #Fit  #ParaCelebrarloUnKebab,control,según prueba médico peso kilo
user1130,aa5463b24b5c,"Tu cuerpo es un templo, cuidalo, valoralo, respetalo, AMALO.",anorexia,cuerpo templo cuidalo valoralo respetalo amalo
user1131,7e5915b35d76,"Pastillas,Lagrimas,Burlas,Voces,Pensamientos suicidas,Vómitos,Así era ella hasta que tomo la decisión de dejar EL QUE DIRÁN",anorexia,pastillaslagrimasburlasvocespensamiento suicidasvómitosasí tomo decisión dejar decir
user1132,552f25ae954b,Quedaràn registrados para su disfrute. #cool #gourmet #disfrute #Galicia #comer #Comida,control,quedaràn registrado disfrutir
user1133,1f2b00e87ad5,"Todo más que perfecto, sigo haciendo ejercicio hasta quemar 400kcal y terminó el día feliz, 
Ojalá no la cague... #ana #mia #bulimia #anorexia #proana #promia",anorexia,perfecto sigo hacer ejercicio quemar kcal terminar día feliz ojalá cagar
user1134,83a39fa3dd2a,Comer por ansiedad. Vomitar por vanidad.,anorexia,comer ansiedad vomitar vanidad
user1135,a838081e7345,mi secreto para vajar 15 kilos en un mes.ayunar 20 dias(no seguidos)tomar 8 litros diarios de te verde retwittea  #rexybill,anorexia,secreto vajar kilo mesayunar diasno seguidostomar litro diario verde retwittear
user1136,6b983781aff8,"Sustituir marcas por las calorías.   Buena acción para concienciar, aunque la calorías solo sean un problema de todos los que encierran los #ultraprocesaos    https://www.instagram.com/p/Bs-WZkmh2_z/?utm_source=ig_share_sheet&igshid=i2mk1aygz41p …",control,sustituir marca caloría buen acción concienciar aunque caloría solo problema encierran
user1137,e8c5a2ae21c1,"Comiendo en un lunes ligero !
#Mexico #Comelones  #ChefHerrera",control,comer lunes ligero
user1138,904c36256b31,Estar comiendo tomates cherris y reírte es todo un peligro.,control,comer tomate cherris reírte peligro
user1139,6be8de48cd15,@mariajose_ro JAJAJA Majo no sufras  sí hueles la comida por 10 minutos se te quita el hambre,anorexia,mariajosero jajajar majo sufra huel comidar minuto quitar hambre
user1140,b4fad2ef3d6b,"Al mal sueño, buen desayuno!!!
A por el miércoles  #realfooding",control,mal sueño buen desayuno miércoles
user1141,276be01ea866,"Extraño a las princesas 

 #proana",anorexia,extraño princesa
user1142,6580f1f4dda4,Creo que tengo vigorexia.,anorexia,creer vigorexia
user1143,abc615f89736,"Si le fallo a Ana, mía me salvara",anorexia,si fallo án salvar
user1144,21f35c39afff,"Y ayer también me dio tiempo a preparar pan de espelta. Esta vez, en bolsa. Lo tradicional también se lleva. #pandeespelta #pan #bread #espelta  #comidacasera #pancasero en… https://www.instagram.com/p/BtjliGSgpiw/?utm_source=ig_twitter_share&igshid=i96pc8jnpbg4 …",control,ayer dar tiempo preparar pan espeltar vez bolsa tradicional llevar
user1145,061668cab7df,"acabo de vomitar más lagrimas que comida 
  #proana #promia #bulimia #bulimianervosa #bulimicgirl #bulimic #anorexia #anorexic #anorexiaeetclub",anorexia,acabar vomitar lagrima comida
user1146,90977e63fe24,No hay frase que más me reviente los ovarios que... “Pero si tu eres guapa de cara”. Gracias por decirme que mi cuerpo es asqueroso. #ana #mia #proana #promia #bebulimic #beanorexic #anorex  #princesas,anorexia,frase reviente ovario si guapa cara gracias decir yo cuerpo asqueroso
user1147,c6b67cf75a1e,"no ala comida 
si ala delgadez",anorexia,ala comida si alar delgadez
user1148,77caf34a4925,"Lo mejor para un día frío como hoy es disfrutar de un buen caldo calentito. Ven al #mercadodelapaz y prueba el delicioso @caldococ Encuéntralo en @LaBoulette_ y en Amazon Prime Now ¡No te lo pierdas!
#degustacion #venatumercado #caldo #bonebroth #consome  #comidacasera",control,mejor día frío hoy disfrutar buen caldo calentito ver prueba delicioso caldococ encuéntralo laboulettir amazon prime now pierda
user1149,fcd8ab76dc5b,"¿Invitados que no quieren pescado? Conquístales con este plato.
#cocinandoparamiscachorritos #merluzarellena  http://blgs.co/V8CB8r",control,invitado querer pescado conquístal plato
user1150,7ed89da0ac1d,"Cada vez estoy engordando más 
 #fat #lunesintratables",anorexia,cada vez engordar
user1151,52b32c5ee352,Sé sigue hasta quemar todo lo que comí y no pude vomitar #ana #mia #bulimia #anorexia #proana #promia,anorexia,saber seguir quemar comí poder vomitar
user1152,dab7e05767ef,Ya e bajado casi 8 kilos gracias a  sin ellas no hubiera podido tengo que tener voluntad para seguir bajando mas...,anorexia,bajado casi kilo gracia podido tener voluntad seguir bajar mas
user1153,6c7d6b8be4fb,Nada peor que comerte 5 panes,anorexia,peor comerte pan
user1154,f89e9abd7303,"Hoy me siento mas gorda, mas cansada y mas deprimida que nunca. Todo apesar de que llevo un kilo menos. Logica?",anorexia,hoy sentir mas gordo mas cansado mas deprimido nunca apesar llevar kilo menos logico
user1155,970046cdcf03,"Cuando la alimentación y los hábitos saludables son piedra angular dla salud dlos adolescentes...
Es fundamental profundizar en el tema a todos los niveles
Redoblar esfuerzos en educar a los chavales y sobre todo a los padres/madres/entrenadores

Obeso NO es fuerte",control,alimentación hábito saludable piedra angular dla salud d él adolescente fundamental profundizar tema nivel redoblar esfuerzo educar chaval padresmadresentrenador obeso fuerte
user1156,55d778be99c1,"En qué consiste la dieta paleo https://buff.ly/2H2oqTG 

#paleo #paleodiet #dieta #nutricion",control,consistir dieto paleo
user1157,80fdda51a089,"Lomo Salteado #lowcarb

en este plata sólo la cebolla es lo que es:

- el lomo no es lomo
- el arroz no es arroz (coliflor)
- las papas fritas no son papas (zapallo italiano)

también puede llamarse
 lomo salteado fake

@MetodoGrez #keto #LCHF #paleo",control,lomo salteado plata sólo cebollo lomo lomo arroz arroz coliflor papas fritas papas zapallo italiano poder llamar él lomo salteado fake metodogrez
user1158,5fdc351eaa4a,Ya no quiero ser gorda   #goals #thinspiration #proana,anorexia,querer ser gordo
user1159,0f7b269bb0e1,"Acabo de descubrir que masticar canela te quita cabrón el craving por lo dulce, el pan y, en general, por comer lo que no debes. De nada, amikas.  #blessed",anorexia,acabar descubrir masticar canela quitar cabrón craving dulce pan general comer deber amikas
user1160,dc2b7fe19ba0,"Y esta noche ¿qué?...¿carne, pescado, verduras?...
Si no quieres caer en la misma rutina, prepara una guarnición alternativa: #patatas a la mantequilla.Fácil, fácil y ¡rico, rico!  ¡Haz la prueba! Te dejamos la receta https://www.directoalpaladar.com/recetas-de-salsas-y-guarniciones/receta-de-patatas-a-la-mantequilla …
#LasRecetasDeHijolusa",control,noche carne pescado verdura si querer caer mismo rutina preparar guarnición alternativa mantequillafácil fácil rico rico haz prueba dejar receta
user1161,1954f82726b5,"Hoy solo tomare cafe sin azucar y agua todo el dia, hoy es viernes de ayuno.",anorexia,hoy solo tomare cafar azucar agua diar hoy viernes ayuno
user1162,de0d9694066d,"Dulce y suave!
Para merendar? O de postre, porqué no!
100% casera! 
100% golosa!
#CaféÁgora #leonesp #burguer  #slowfood #healthy #menu #gourmet #carrotcake",control,dulce suave merendar postre porqué caserar goloso
user1163,428a0ad680dc,#antojo que mierda mañana me va a tocar pasar todo el día con lax.  #quieroserflaca #depression,anorexia,mierda mañana ir tocar pasar día lax
user1164,5b713c85cbe3,"Viendo el partido con mucha comida a mi alrededor , soy fuerte al no comer nada , me da ascoooo todo !! #yopuedo #soyfuerte  #mivida",anorexia,ver partido mucho comida alrededor fuerte comer dar ascoooo
user1165,0beb27ecae74,"Esta diarrea de 4 dias me ha quitado 2 kilos de ensima... Si logro mantenerla mas, lograre llegar a mi peso ideal en 12 dias :D",anorexia,diarrea dia quitado kilo ensimar si lograr mantener él mas lograre llegar peso ideal dia d
user1166,dc0427013a97,Según q cuerpo consumimos entre 1500 y 2500 kcal diarias. Lo ideal es q normalmente en esas kcal q necesitamos estén ls alimentos más nutritivos y saludables posibles. No tiene sentido q ocupemos la gran parte de nuestras kcal diarias en bolleria industrial por ejemplo.,control,según q cuerpo consumir kcal diario ideal q normalmente kcal q necesitar ls alimento nutritivo saludable posible q ocup gran parte kcal diarias bollerio industrial ejemplo
user1167,978e54bd499d,"El único fruto del amor... es el aguacate
Los alimentos andaluces BIO te esperan en Biofach (Nuremberg, Alemania) de la mano de Extenda.

Be Bio. Be healthy. Be real. Be Sur. 
… https://www.instagram.com/p/Bt8I8rlnqaD/?utm_source=ig_twitter_share&igshid=1q7pp3j6744cl …",control,único fruto amor aguacatar alimento andaluz bio esperar biofach nuremberg alemania mano extendo be bio be healthy be real be sur
user1168,9360809ab8bb,"Bonitos recuerdos con @telemundohou y las texanscheerleaders Video completo en mi bio  #htown #boxing  #nfl #nflcheerleaders #houstontx #texans @ Houston, Texas https://www.instagram.com/p/BvQIjzmhZrc/?utm_source=ig_twitter_share&igshid=14exqoz3y1nkq …",control,bonito recuerdo telemundohou texanscheerleader video completo bio houston texas
user1169,29d3ceb03c24,"Comí como una gorda, no lo puedo creer... Me siento mal y quiero llorar, porque me odio y no puedo creer que no sea capaz de hacer las cosas bien aunque sea una vez en la vida #ana #mia  #anorexia #bulimia #proana #promia #ed",anorexia,comí gordo poder creer siento mal querer llorar odio poder creer capaz hacer cosa bien aunque vez vida
user1170,5837253a47e1,Muero de hambre  pero no sedere,anorexia,muero hambre sedere
user1171,5e6e4dd68f8e,"Dejé a Ana y a Mia hace muchos años, pero cuando estoy estresada o frustrada vuelven a aparecer cualquiera de las dos, valen verga esas dos  #vvlv",anorexia,dejar ana mia hacer año estresado frustrado volver aparecer cualquiera dos valer vergo dos
user1172,4951b5356332,Aunque no lo he podido grabar si he sacado fotos y en cuanto esté #horneado subiré la receta al blog para enseñaros como hago yo el #pollorelleno y está #delicioso #recetasnavideñas #recetas #comerecociñartodoeempezar #pollo #chiken #requetedelicioso,control,aunque poder grabar si sacar foto cuanto subiré receta blog enseñaro hacer
user1173,e90bc2aeca6a,A ver  quiero bajar 20kg en una semana coml vergaa de le hago pa dejar de tragar?,anorexia,ver querer bajar kg semana coml vergaa hago pa dejar tragar
user1174,d33f6ca623c9,Qué difícil es comer. Me quedaré aquí a sobrevivir de lo que queda en este vaso de agua.  #TipsdeNutricion,anorexia,difícil comer quedar aquí sobrevivir quedar vaso aguo
user1175,b73351cf2db0,"El placer de la vida, comer rico y no engordar.
.
Cuida tu salud, cuida tu mente y cuida la única casa donde vives realmente.
#comida #sana #variado #arroz #rico  #healthyfood… https://www.instagram.com/p/BqX2dBinZ2Q/?utm_source=ig_twitter_share&igshid=64kzo5slza07 …",control,placer vida comer rico engordar cuido salud cuido mente cuido único casa viv realmente
user1176,fe6a3ae5850a,Tarde o temprano aprenderás q nada es todo y todo es nada...#depression  #youandmi #Ana #mia #kute,anorexia,tarde temprano aprenderás q
user1177,98197a61396d,Lindo día para todos @dandydcuba @PRCFest @michaeljackson #instadaily #travel #life #cute  #nature #beauty #girl #fun #photo #amazing #likeforlike #instalike  #Selfie #smile #me #lifestyle #model #follow4follow #music #friends #motivation #like #food #inspiration #Repost,control,lindo día dandydcuba prcfest michaeljackson
user1178,8bfaccc214ab,"Todo lo que me nutre, me destruye.",anorexia,nutre destruir
user1179,220b11d13d2b,"Princesa que se respeta ayuna 8 horas diarias (se puede contar las horas en las que duermes) 
#proAna  
Pendejas",anorexia,princesa respetar ayún hora diario poder contar hora duerm pendeja
user1180,b6d03924ba0b,"Cuando estas bien hidratado, tu cuerpo es más eficiente para quemar calorías.  #nutricion  #perderpeso #adelgazar",control,bien hidratado cuerpo eficiente quemar caloría
user1181,736feacb8529,"Yo en realidad no existo, solo soy un personaje creado por la sociedad, fabricado a base de verdades a medias, de mentiras bonitas, en busca de un sueño tan absurdo como inalcanzable. Y así como yo no existo, tú tampoco, la autenticidad es un espejismo.
#ana #mia  #ayuno",anorexia,realidad existo solo personaje creado sociedad fabricado base verdad medio mentira bonito buscar sueño tanto absurdo inalcanzable así existo tampoco autenticidad espejismo
user1182,63bd192a64ac,Ellas son tan hermosas   #Thinspo #Thinspiration,anorexia,tanto hermoso
user1183,a018de56e4ff,"Mi snack de hoy  pan de @lasastreriadelpan de cacahuate  con una cucharada de mantequilla de cacahuate  sin azúcar, 3 almendras y linaza para decorar, una delicia  alto en grasas saludables y mega saciante    ing #desayuno #comida #cen…",control,snack hoy pan lasastreriadelpar cacahuate cucharado mantequilla cacahuatir azúcar almendra linazar decorar delicia alto grasa saludable megar saciante ing
user1184,3c489f7a1727,"Esta enfermedad es una lucha diaria, que no termina nunca. Cansada pero nunca voy a dejar de pelearla",anorexia,enfermedad lucho diario terminar nunca cansado nunca ir dejar pelear él
user1185,343b58bc3576,Sabes que te has hecho mayor cuando cenas kale y espinacas,control,saber hecho mayor cena kale espinaca
user1186,0a1858d19fd9,"#quieroser perfecta 
 rumbo a la perfección.",anorexia,perfecto rumbo perfección
user1187,74a0ce922ae9,"La “pastilla mágica” se llama sudor y trabajo duro! 

#imagenfit #estilodevidasaludable #elmejorcuerpodetuvida #lametaesparasiempre #fitisin #fitspiration … https://www.instagram.com/imagen_fit/p/BvRtw_8B5PY/?utm_source=ig_twitter_share&igshid=b7pjafln2hq4 …",control,pastilla mágico llamar sudor trabajo duro
user1188,774dd23b47b9,Las ensaladas pueden llenar y ayudará a resistir más las comidas.  #nutricion  #perderpeso #adelgazar,control,ensalada poder llenar ayudar resistir comida
user1189,127d63cf7d0f,Demasiada gordura para 43kg de carne,anorexia,demasiado gordura kg carne
user1190,6bb3c48e88f4,"Fitness: El mejor aliado para tu cuerpo y tu mente 
http://goo.gl/jCwpNN   #coaching por @nessitafitness",control,fitness mejor aliado cuerpo mente nessitafitness
user1191,04b013396332,"Busco excusas para no afrontar lo que tanto miedo me da afrontar:
COMER!!

#anorexia #bulimia  http://ow.ly/FeQnp",anorexia,buscar excusa afrontar miedo dar afrontar comer
