user_id,tweet_id,tweet_text,class,tweet_text_clean
user0661,935b4a84a0fd,Rica cena hecha con mucho mimo    #tartadesalom #aguacate #cebolla #canonigos #unbaberoparamama,control,rico cena hecho mimo
user0662,b8749cb4c269,"Queso fresco de cabra a la plancha, aguacate, pimientos asados, anacardos. Podría ser mi cena de anoche pero ha sido mi desayuno #desayunoreal #desayunodiferente #desayunosalado   er ing #keto https://ift.tt/2ttPOoH",control,queso fresco cabrar plancha aguacatar pimiento asado anacardo poder ser cena anoche ser desayuno er ing
user0663,0bb9535d5f0f,Arroz con tomate y fritos variados #buencomer #soyungordo #comida #comidasana #dietasana #pan #arroz #croquetas #deliciasdepollo #palitosdemerluza #hoycocinoyo #cocinoyo #delicioso #food,control,arroz tomatir frito variado
user0664,abb0bf0f38bb,"Buen día.A comer! Así de completo en nutrientes 

#comidasaludable   #nutrición #perdergrasa #perderpeso #healthy #healthyfood https://www.instagram.com/p/BpcSZk-glYC/?utm_source=ig_twitter_share&igshid=1y26ohdiwndan …",control,buen díaa comer así completo nutrient
user0665,5c81cc9996ac,"#MartesdeRecetas Nos encanta esta combinación de plátano y piña, un desayuno diferente y muy saludable @Gastronomiaycia #Gabaceras",control,encantar combinación plátano piña desayuno diferente saludable gastronomiaycia
user0666,e17db81d5ae1,"Juntos somos mejores
Entrenos cada día más serios
Enhorabuena EQUIPO!
##cepalmarunners #entrenamientofuncional #functionaltraining #fit  @ Sport Hub Mallorca — at Sport Hub Mallorca https://www.facebook.com/483284211766174/posts/2502946009799974/ …",control,junto mejor entreno cada día serio enhorabuena equipo sport hub mallorca at sport hub mallorca
user0667,85f1fb01c21f,"Me acostumbré a mentirles a mis papás, pero mentirle a mi pareja se me hace más difícil",anorexia,acostumbré mentirl papás mentir él pareja hacer difícil
user0668,0b454c9b6e51,"Granita de frutas y vino con jarabe de pera, Ideal para los días calurosos.

http://ow.ly/IMC530nJvs1 

#cocinafacil #comersano #healthyfood #foodporn #food #foodie #foodgasm  #lovecooking  #instafood #recetasrapidas #recipe #recipes #recetas #comidamexicana #mexicanfood",control,granitar fruta venir jarabe pera ideal día caluroso
user0669,5c41a0eb7197,"Se que puedo lograrlo...
Solo debo esforzarme más...

#anaymialifestyle  #anaymiaforeverfriends #anaymiaarequeen #anaymiaporsiempre #anaymiatips #thinsp0 #collarbones #thighgaps… https://www.instagram.com/p/Bup4cbCATHP/?utm_source=ig_twitter_share&igshid=4xwjt89os2n …",anorexia,poder lograr él solo deber esforzarme
user0670,61b0d342d93b,"No hagas caso, acá desde el club de  te seguimos echando porras, vamos por más (obvio es broma), la verdad la gente es envidiosa y no sabe el compromiso que se requiere para respetar un plan alimenticio   ...",anorexia,haga caso acá club seguir echar porra ir obvio broma verdad gente envidiós saber compromiso requerir respetar plan alimenticio
user0671,9f3666568b60,"Hoy solo me he mandado medio café, no pienso comer nada #ayuno #anorexic #bulimic  #fat #gorda #proana #thinspo #thinspiration",anorexia,hoy solo mandado medio café pensar comer
user0672,7b08dde3e715,"Veo mi nueva camisa de Muse y sólo me dan ganas de ya no comer por el resto de mi vida, por que quiero verme bien.",anorexia,ver nuevo camisa muse sólo dar gana comer resto vida querer ver yo bien
user0673,ea8d232f9d9b,ya sé calcular las calorías en las comidas  #edgirls,anorexia,saber calcular caloría comida
user0674,4d08ee28a512,Esta vida #healthy  #satanicpotato que llevo me está matando. Debería darme a las drogas.,control,vida llevar matar deber dar yo droga
user0675,0e1765f7b99c,"¿Quieres una comida ligera? 
Este platillo es ideal para ti. 
Disfruta de una deliciosa ensalada solo en Parcela 70.  

Visita nuestro sitio web.   
https://www.parcela70.com/es/  

 #ComidaGourmet #Restaurant #Restaurante #RestauranteMexicano #Comidas",control,quier comida ligero platillo ideal disfruta deliciós ensalado solo parcela visitar sitio web
user0676,078558f62981,"Tercer día de la dieta ABC.
>.<“ ayer hice las 500 kcal... a ver hoy las 300...",anorexia,tercer día dietar abc ayer hacer kcal ver hoy
user0677,747d1f385c85,"No te canses de intentarlo y convertirás lo imposible en una realidad 
#FundaciónAPE #TCA #bulimia #anorexia  #trastornosporatracón #trastornosalimentarios #stopTCA",anorexia,cans intentar él convertirás imposible realidad
user0678,62bc78d83f5a,"Recuerda No caer en Tentación decir ""No gracias"" a la comida es un ""si porfavor"" A La delgadez.

#aym  #bulumiagirl",anorexia,recordar caer tentación decir gracias comida si porfavor delgadez
user0679,b1111618fee3,"1050 kcal quemadas, ni yo lo puedo creer gente #ana #mia  #anorexia #bulimia #proana #promia #ed",anorexia,kcal quemado poder creer gente
user0680,cc65ab05dd82,"¡Y el plato fuerte del almuerzo! Comer sano no significa comer aburrido, “feo” o insípido. Solo es tener cuidado en la calidad de los ingredientes y elegir los que son beneficiosos para nuestro cuerpo, y no los dañinos.  #fitfood #HealthyLife #yoga",control,plato fuerte almuerzo comer sano significar comer aburrido feo insípido solo tener cuidado calidad ingredient elegir beneficioso cuerpo dañino
user0681,de88c6bf13b3,"dedicado a los/as ""no tengo tiempo para comer bien"", con un no quiero, no me apetece o un simple paso...

#menjarsaludable  #vegan",control,dedicado losa tiempo comer bien querer apetecer simple paso
user0682,da404ccc483b,He visto este reto y mi cabeza transtorner no ha podido evitar hacer el memo un rato. #someonelikeyouchallenge  Seguro que le gusta a @Midietacojea @JulioBasulto_DN y @juanjocaceresn ;),control,visto reto cabezar transtorner poder evitar hacer memo rato seguro gustar midietacojeo juliobasultodn juanjocaceresn
user0683,55aae2f7bebf,de verdad estáis a gusto con unos brazos y piernas esqueléticos?? Eso es lo menos sexy que he visto en mi vida.,anorexia,verdad gusto brazo pierna esquelético menos sexy visto vida
user0684,ebfbbd777d29,"La alianza con Diego Alonso - Preparador Físico garantiza el cumplimiento de la filosofía Wingsport ya que cuenta con una metodología técnica única, avalada científicamente, y una gran experiencia a lo largo de los años que garantiza el éxito.
#entrenamiento  #deporte",control,alianza diego alonso preparador físico garantizar cumplimiento filosofía wingsport cuenta metodología técnico único avalado científicamente gran experiencia largo año garantizar éxito
user0685,4011cd20e962,Parece que me mantengo en mi peso y empiezo a bajar poco a poco.... Quiero ser una  princesa mejor que la otra vez...,anorexia,parecer mantengo peso empiezo bajar querer ser princesar mejor vez
user0686,e6ee779aa984,"¿Cómo lleváis el lunes?
¿Bien? 
¿Mal? 
¿Regular? 
¡Tranqui, que la oferta semanal no se nos ha olvidado!  
Y como siempre te lo llevamos a casa sin mínimo de compra y con el envío gratis http://www.disanfrio.com 

#disanfrio #oferta #receta  #comida #gourmet #pavo",control,cómo lleváis lunes bien mal regular tranqui oferta semanal olvidado siempre llevar casa mínimo compra envío gratis
user0687,2bd43d94a0fe,"Aguacate, tomate, zanahoria... Vemos esta ensalada fresca y no nos podemos resistir. Si quieres probarla ¡solo tienes que pasarte por #panaria de La Vital!
.
.

#lavital #lavitalcc #panaria #comidasana #ensaladas
#healthyfood #greenfood #centrocomercial  #lasafor #spring",control,aguacatar tomate zanahorio ver ensalado fresco poder resistir si querer probar él solo pasarte vital
user0688,c94cf481fd1a,@swagger_clara @CandyHentai ¿No os da asco que niñas se crean guays poniendose  en la biografía? A mi si.,control,swaggerclar candyhentai dar asco niña crear guay poner él biografía si
user0689,fe0ac1d7a502,Si quieres salir de  no dudes en escribirnos. Trataremos de ayudarte y recomendarte los mejores profesionales.,control,si quier salir dud escribirno tratarer ayudarte recomendarte mejor profesional
user0690,0cbcf694ed90,"Hoy mi madre mientras yo desayunaba una tostada con tomate rallado por primera vez ha dicho ""es mejor eso que estás guarrerías (cestita de ultraprocesados)""",control,hoy madre mientras desayunar tostado tomatir rallado primero vez dicho mejor guarrería cestitar ultraprocesado
user0691,b794755076e1,"Llegó a pesar 35kg, ahora pesa 63 kilos
Y su lucha continúa para hacer frente a su #Anorexia 
http://ow.ly/jKvN305LzPp",control,llegar pesar kg ahora pesar kilo lucha continuar hacer frente
user0692,a8e3641b8a9e,"Y me acostumbré a vivir así, dependiendo de todo menos de mí.
Testimonios #Anorexia  #TCA
http://ow.ly/QpeL30aKKY2",anorexia,acostumbré vivir así depender menos testimonio
user0693,491cf46a85be,"En http://instagram.com/vitonica_com   Más sencillo... ¡IMPOSIBLE! Los tres macronutrientes en un solo plato: - Pan integral  carbohidratos
- Aguacate machacado  grasas saludables
- Huevo poché  proteínas
- Espinacas
- ¡Y que aproveche!

#receta #recipe #eatrealfood  #ag…",control,sencillo imposible tres macronutrient solo plato pan integral carbohidrato aguacatar machacado grasa saludable huevo pocher proteína espinaca aproveche
user0694,a83f25d6bbb8,Como logramos mejorar nuestra estabilidad corporal? El Yoga o Pilates son fantásticos ejercicios para lograrlo. Mira estos 5 ejercicios que te traigo hoy #20Mar #WednesdayMotivation #FelizMiercoles #Miercoles  #salud #WednesdayWisdom,control,lograr mejorar estabilidad corporal yogar pilat fantástico ejercicio lograr él mirar ejercicio traigo hoy
user0695,8ea4a1e07e97,No tengo una enfermedad. La misma sociedad hace que quiera ser delgada. No es bonito que te comparen con alguien delgada.,anorexia,enfermedad mismo sociedad hacer quiera ser delgado bonito comparen alguien delgado
user0696,73513f95d5d0,"Quieren que haga algo al respecto,  perfecto sufrirán conmigo.  Total de algo me voy a morir y les voy a dar el gusto.",anorexia,querer hacer respecto perfecto sufrir conmigo total voy morir ir dar gusto
user0697,c99f02c1af9d,"Tanto apuntar con la pistola y no disparas... hazlo ya maldita sea...
Quitame este sufrimiento!
#thinspo #ana",anorexia,apuntar pistola dispara hazlo maldito quitame sufrimiento
user0698,bec52c3b97a9,Jueves de lluvia. Noche de #Thinspo,anorexia,jueves lluvia noche
user0699,6c60a060efdd,"Ironía: Saber hornear & Cocinar pero no pueder comer una sola rebanada o cucharada sin querer usar a Mía.
 #Thinspo #Ironico",anorexia,ironir saber hornear cocinar pueder comer solo rebanada cucharado querer usar
user0700,06b4a0165e6a,"Esta semana en #eldivandelorena hablaremos de la #anorexia y la #bulimia.
No se lo pierdan. http://www.eldivandelorena.blogspot.mx",control,semana hablaremos perder
user0701,b78de9728208,vamos x menos hasta q el reflejo ya no duela  marca mis huesos y no mis muñecas #suicida #anorexia # bulimia,anorexia,ir x menos q reflejo duela marca hueso muñeca bulimio
user0702,e50dda3a746f,Solo quiero ser delgada.,anorexia,solo querer ser delgar
user0703,d474af4a1ece,"https://buff.ly/2b4AVnm  para lucir esas piernas y ese abdomen, mucho #workout en el invierno y sacrificios para lucir ese #bikin este #summer #verano #playa #fit",control,lucir pierna abdomen invierno sacrificio lucir
user0704,8c976693c7d3,despues de la pizza me hago friend de ana y mia #pizza #ana #mia  #princess https://instagram.com/p/0jNebDqqQp/,anorexia,despu pizza hacer friend ana mia
user0705,889b23b073c9,"Y ara, a preparar el dinar!  

#LlentiesEstofades 
#Mediterraneamente",control,ara preparar dinar
user0706,6e2906c64d17,"#Anorexia y #Bulimia 
 Toma laxantes, muérete de hambre, haz lo que sea para parecer más delgada.
https://youtu.be/IGSv-cVw_4c  @YouTube",anorexia,tomar laxant muérete hambre hacer parecer delgado youtube
user0707,8ca474333968,"pasa de dietas que son una bobada

https://youtu.be/-u32H6Vb0co",control,pasar dieta bobado
user0708,2c7fa0546627,"#bajardepeso  A la hora de adelgazar, ¿es mejor contar calorías o fijarnos en los macronutrientes?",control,hora adelgazar mejor contar caloría fijarno macronutrient
user0709,413cdfd5fcd4,mis mejores amigas ahora si estoy viendo resultados aunque coma por la mañana y por la tarde !! No se que aria sin vosotras,anorexia,mejor amiga ahora si ver resultado aunque coma mañana tarde ario
user0710,f9447ee917dd,¡Hola mi querida #princesa ! No te dejes devorar por quien realmente te quiere ver muerta. Hay una alternativa de una vida hermosa,anorexia,hola querido dej devorar realmente querer ver muerto alternativo vida hermoso
user0711,39906bdd3b35,"A veces el placer de comer se encuentra en los contrastes de aromas y sabores en el mismo plato, tal es el caso de estos boquerones al ajillo con piparras. 
Reservas al  856 13 63 10.
.
.
.
#restaurante 
#gastronomia 

#queso
#comidasana
#branding
#jerez
#cocina",control,vez placer comer encontrar contrast aroma sabor mismo plato tal caso boquerones ajillo piparra reserva
user0712,89098eee293b,"Ejemplo de un buen #desayuno equilibrado: #Tostada de pan de centeno, tomate, canónigos y huevo. ¡Pruébalo! Delicioso y nutritivo para comenzar con energía la mañana. #salud #HealthyLife",control,ejemplo buen equilibrado pan centeno tomatir canónigo huevo pruébalo delicioso nutritivo comenzar energía mañana
user0713,5c3501d74303,"Si puedo!! Lo se no decaigo!! Solo 6 kilos mas y completo mi meta 
1 mes para conseguir mi objetivo
45kg!!  #motivacion *-*",anorexia,si poder decaer solo kilo mas completo meta mes conseguir objetivo kg
user0714,e5ce892fe1dd,Ser #Bulimico jamas fue tan difícil! Hasta q la sociedad te pega por la espalda y te metes en el rollo  y aun así no eres #Perfecto,anorexia,ser jama tanto difícil q sociedad pega espalda met rollir aun así
user0715,213b14852f80,“@barby_aranda: Lo malo de llorar es que te arden muuucho los ojos   #ED #sue #cut #hate” no mames  eres la más «anoréxica» de tw,anorexia,barbyarandar malo llorar arder muuucho ojo mam anoréxicar tw
user0716,e946a1d61d36,#pic #thin #thinspiration #motivation #thinsgap #thinspo #skinny #legs #perfect #outfit   La amo. Ella es una de mis thinsp. fav,anorexia,amar thinsp fav
user0717,18800e717654,"Es lamentable tener que aguantarse las ganas de comerte algo para no terminar teniendo un atracón:(
#fat #fast #proana  #gorda #anorexic #thinspo #thinspiration",anorexia,lamentable tener aguantar él gana comertar terminar atracón
user0718,7108e8542b2f,"2 kilos en 1 dia mas gorda no puedo estar... pierdo el control de nuevo 

#ihatemylife",anorexia,kilo diar mas gordo poder pierdo control nuevo
user0719,ad2c01640c9d,#Gym A todo ritmo! Km.16  #LL,control,ritmo km
user0720,680694d298ac,"Comida real y fácil.  

Ingredientes:

- 3 huevos  
- Espinacas  
- Rulo de cabra 
- Aceite de oliva 

Saltear las espinacas, mezclarlas con el huevo y añadir rulo de cabra.
Tiempo: 5 minutos. 
Dificultad: Muy fácil",control,comida real fácil ingrediente huevo espinaca rulo cabrar aceite olivo saltear espinaca mezclarla huevir añadir rulo cabrar tiempo minuto dificultad fácil
user0721,243825c0524c,Lo que mas me gusta del verano es que no me dan ganas de comer #anorexia #goals,anorexia,mas gusta verano dar gana comer
user0722,4517b0d578da,"Hoy corremos
Today, we #run

#running #runner  #fit #training #workout #gym #runners #motivation #sport #instarunners #instarun #marathon #trailrunning #runhappy #cardio #runningmotivation #runnersofinstagram  #love #instarunner #instagood motivation #healthy",control,hoy corremo today we motivation
user0723,6edf0558077b,"No dormí nada, pero me voy a poner a hacer ejercicio porque me doy asco. #ana #mia #anorexia #bulimia  #proana #promia #ed #tca",anorexia,dormí voy poner hacer ejercicio dar asco
user0724,2764612994bb,"Hoy en el #DíaInternacionalContraLosTCA aprovechamos para compartir una intervención de nuestro compañero @MarcRuizDeMinte sobre trastornos de la conducta alimentaria.en el programa de @addelagonzalez.
#anorexia #bulimia",anorexia,hoy aprovechar compartir intervención compañero marcruizdeminte trastorno conducta alimentariair programa addelagonzalez
user0725,eaee1109761e,"Mi metabolismo cambio 
Mi figura cambio 
mi forma de pensar muta
No la extraño aveces por verme gorda si no por que  eran compañeras",anorexia,metabolismo cambio figurar cambio formar pensar muta extraño avez verme gorda si compañera
user0726,f8fa75f36fa5,Pongamos esta foto en el refrigerador,anorexia,poner foto refrigerador
user0727,16d24a9de0b0,"Almuerzo llego de nutrientes, antioxidantes y . .
.
.
Ensalada de kale, rugula, tomate, mango y cebolla morada aderecé con un poco de sal, limón y aceite de oliva . Pescado atún  a la pancha y palatino macho
  #infalob
.
#almuerzosaludable #hea…",control,almuerzo llego nutrient antioxidant ensalado kale rugular tomatir mango cebollo morado aderecé sal limón aceite olivo pescado atún pancha palatino macho
user0728,815d7b6c64f7,Ellas también buscaban un cuerpo perfecto y perdieron el control... Testimonios #anorexia #bulimia  http://ow.ly/AYSem,anorexia,buscar cuerpo perfecto perder control testimonio
user0729,2da761c8fa10,"Como dice el dicho, #compartir es vivir, y que mejor que compartir una buena #lubina a la #sal... ¡espectacular!, ¿os apetece? #sabor #ensupunto #horno #lubina #comidasana  #pescadofresco #madridrio #arganzuela",control,decir dicho vivir mejor compartir buen espectacular apetecer
user0730,1f314f0a270a,"Banda iliotibial: siete estiramientos para aliviar el dolor de cadera y rodillas, vía @WomensHealthESP 

http://ow.ly/uPgG30nMvlk 

#YoSoyFEDA",control,banda iliotibial siete estiramiento aliviar dolor caderar rodilla vía womenshealthesp
user0731,70692023408d,"Me están obligando a cenar porque ya sospechan, lo único que digo es, qué tan pelotuda soy que siempre se dan cuenta? #ana #mia #anorexia #bulimia  #proana #promia #ed #tca",anorexia,obligar cenar sospechar único decir tanto pelotuda siempre dar cuenta
user0732,aaf4d76072e8,Lo que necesitas para comenzar.  #Motivación pic.twitter.com/1DSGYI1zpK,control,necesita comenzar pictwittercomdsgyizpk
user0733,b11007c61ebd,"La relación entre ultraprocesados y obesidad probada por un nuevo estudio
#obesos #obesidad #fueraultraprocesados
#adelgazar #perderpeso #salud #dietas #comersano … https://www.instagram.com/p/BvO3uUtnT1W/?utm_source=ig_twitter_share&igshid=1sph9ix551d83 …",control,relación ultraprocesado obesidad probado nuevo estudio
user0734,2feafae44830,Comienza a cambiar tu #cuerpo en @impactogimnasio !! #cuerpodeimpacto #cuerposano #salud,control,comenzar cambiar impactogimnasio
user0735,f8d9469a543c,Los mismo que odian a  son los mismos que van llamando gord@ a cualquiera. Hipócritas de mierda,anorexia,mismo odiar mismo ir llamar gord cualquiera hipócrita mierdo
user0736,ae47c0381dc0,"Aveces lo que nos detiene esta en nuestra mente.

#health  #fit #TFLers model addict #fitspo #workout #bodybuilding #cardio #gym #train #training #photooftheday… https://www.instagram.com/p/BvKIvkOBEKn/?utm_source=ig_twitter_share&igshid=1kw8dfk3tj84f …",control,avez detener mente model addict
user0737,b74d44753199,"Cuando le das resultados a tus practicantes en un mes, EMPIEZA la adicción al  que no es más q llevar una vida saludable, aquí ENTRENAS, no haces… https://www.instagram.com/funcionalgymxpress/p/BvHiyA5hdc9/?utm_source=ig_twitter_share&igshid=1m6lv9pbtn50i …",control,das resultado practicante mes empezar adicción q llevar vida saludable aquí entrena haz
user0738,99dfc5c0fc40,me siento mejor estando delgada porque pienso que así gusto más a los demás - Testimonio #anorexia #bulimia  http://ow.ly/AwUuq,anorexia,sentir mejor delgado pensar así gusto demás testimonio
user0739,687832d1231d,"Este #pudding  vegano de cacao  y #maca con remolacha caramelizada y pistachos que ha elaborado @vanessataste es perfecto para preparar un desayuno completo y equilibrado. 

 No te pierdas la receta  https://bit.ly/2yNBdHN 

 #veganfood #healthyfood #homemade",control,vegano cacao remolacha caramelizado pistacho elaborado vanessataste perfecto preparar desayuno completo equilibrado pierdas receta
user0740,db007728cde5,"¿No les ha pasado que se sienten  como una ballena y rechazan las invitaciones de amigos a salir por sentir verguenza?
#ana  #skinny",anorexia,pasado sentir ballena rechazar invitación amigo salir sentir verguenza
user0741,ef1484dd4563,"¿Por qué permitimos que estos mensajes circulen alegremente? 

#proana #promia 

 http://ow.ly/Dw9T5  http://ow.ly/i/7ogig",control,permitir mensaje circular alegremente
user0742,4af9250b181b,A tomar mi te verde  con canela y laurel,anorexia,tomar verde canela laurel
user0743,f3a15fbdea70,"Mi quemador de grasa y energía 
Fat burner and energy 

#Strength #herbalifenutrition #herbalife24 #business #herbalife #herbaliferesults #protein  #fit motivation… https://www.instagram.com/p/BvZsOqMBlFl/?utm_source=ig_twitter_share&igshid=17la6r433o2nm …",control,quemador grasa energía fat burner and energy motivation
user0744,254c852cf60e,"Transforma tu cuerpo en 21 días con @patryjordan , la gurú del  a la que siguen un millón de personas al día  

PLAN DE RUTINAS PARA 21 DÍAS + PAUTAS PARA UNA 
#AlimentaciónSaludable  

https://www.tirant.com/libreria/libro/9788408205685 …

#deporte #ejercicio #libro #EnForma",control,transformar cuerpo día patryjordir gurú seguir millón persona día plan rutinos día pauta
user0745,7ddcd683808d,"Que sí, que hay alimentos vegetales con proteína completa #proteinacompleta",control,alimento vegetal proteína completo
user0746,7e816a854887,"No había mucho hambre ni mucho tiempo:

Rollos de jamón con relleno con queso cheddar salteados

@MetodoGrez #keto #lchf #lowcarb",control,hambrir tiempo rol él jamón relleno queso cheddar salteado metodogrez
user0747,125cb678dee8,"Brócoli salteado con ajito, gambas, salsa de soja y sésamo. En las stories tenéis la receta flash   er ing https://ift.tt/2tAPKmV",control,brócoli salteado ajito gambas salsar soja sésamo stori receta flash er ing
user0748,8b0d619ae950,Me da asco decir mi peso en voz alta.,anorexia,dar asco decir peso voz alto
user0749,43a757562dea,"Muchas actividades físicas, especialmente aquellas realizadas por personas neófitas en el mundo del , el entrenamiento o el running, si no se realizan de manera apropiada, pueden llegar a causar lesiones. 

https://buff.ly/2FfEhyz",control,mucho actividad físico especialmente aquel realizado persona neófita mundo entrenamiento running si realizar manera apropiado poder llegar causar lesión
user0750,e8a8f303680d,Sentir el filo cortando tu piel,anorexia,sentir filo cortar piel
user0751,ab3c2cff9fac,No he podido hacer los ejercicios... me han llamado para ir a casa de mi abuela... puta familia...,anorexia,poder hacer ejercicio llamado ir casa abuela puta familia
user0752,0d9528ae63dc,Tengo 10 días para bajar de peso así que si me dan consejos estaría de maravilla!,anorexia,día bajar peso así si dar consejo maravilla
user0753,ec54635a7c16,"¿Hasta cuándo tengo que aguantar todo esto? Siento que no puedo más.
.
.
me quiero romper el corazón a mi misma
  #bulimia #bulimianervosa #bulimicgirl #bulimic #anorexia… https://www.instagram.com/p/BsJ5R0XAgsf/?utm_source=ig_twitter_share&igshid=zu2tr19sl4su …",anorexia,cuándo aguantar siento poder querer romper corazón mismo
user0754,529affa8746a,#VidaSana Girl amiga si querés te armó una dieta detox,control,girl amigo si querés armar dieta detox
user0755,febc8496512d,Distintos tipos de abdominales para bajar la panza,anorexia,distinto tipo abdominal bajar panza
user0756,8eae253f73f2,"""antes muerta que gorda """,anorexia,muerto gordo
user0757,01718b58ee16,"Estuve pensando  
Que bueno que no tuve hermanas, qué tal que ellas fueran las flacas 

#sorrynotsorry  a todo lo que da",anorexia,pensar bueno hermana tal flaca dar
user0758,a6b1535790be,Estoy en ayuno total desde hoy hasta el lunes  clásico,anorexia,ayuno total hoy lunes clásico
user0759,3b0d6f80c856,Darte cuenta que estas GORDA!!! Modo dieta extrema solo AGUA Y AIRE   no tengo que dejarla nunca más soy una,anorexia,darte cuenta gordo modo dietar extremo solo agua aire dejar él nunca
user0760,3af60746acd7,#FundaciónAPE trabaja para impulsar la concienciación ciudadana sobre los riesgos de aparición de los #TCA y el cambio cultural necesario que minimice estos riesgos http://mtr.cool/qqjgrcy  #TCA #bulimia #anorexia  #trastornosporatracón #trastornosalimentarios #stopTCA,anorexia,trabajar impulsar concienciación ciudadano riesgo aparición cambio cultural necesario minimizar riesgo
user0761,4af4ce03ec44,"#TCA
Vómitos autoinducidos: Una MALA estrategia para #adelgazar  …http://expertoentrastornosdelaalimentacion.com/blog/2015/02/04/vomitos-autoinducidos-una-mala-estrategia-para-adelgazar/ …

#bulimia #adolescentes  #anorexia",control,vómito autoinducido malo estrategia
user0762,cdef6f71e53c,"si me dices 'plis' me puedes.

  es lo que está señora se comería.",control,si decir pli poder señora comer
user0763,077f439ef666,"LOSE MAZINDOL
un auxiliar en el control de peso
para adelgazar sin hambre 
#DiaInternacionalDeLaFelicidad #FelizMiércoles #Tokio2020 #DíaMundialDeLaFelicidad #primavera #NoHayPeluchesMiniso  #Madero #Tampico #Dieta #Obesidad #Fit  girl #ArcticMonkeysXSopitas",control, él él mazindol auxiliar control peso adelgazar hambre girl
user0764,ba98de07f3f2,"Es mejor sólo comer comida real que si nos nutre y nos evitamos tantos problemas como los colorantes artificiales.
—",control,mejor sólo comer comida real si nutrar evitar tanto problema colorant artificial
user0765,19c2c63bb5a8,"#tip 003
Una infusión de té verde sin endulzante quema unas 100 calorías diarias.
 #thinspiration #thin #motivation",anorexia,infusión té verde endulzante quema uno caloría diario
